"variable_name","construct","domain","question_text","response_type","response_options","out_of_range_codes","is_reverse_coded","waves_present","is_platform_indexed","platform_codes_applicable","wording_changed_across_waves","coding_changed_across_waves","change_notes","clean_variable_name","notes"
"q_ai12_6","AI Tool Harmfulness — Why (AI Organizational Decision Automation) (free text)","AI_ATTITUDES","In a sentence or two, please describe why your experience(s) with applications that use AI to automate organizational decision processes, such as job interviews, scheduling, or hiring/firing was or was not harmful.","STRING_OPEN","","","FALSE","2,3","FALSE","","FALSE","FALSE","","ai_tool_harmful_desc_6",""
"q_ai13_6","AI Tool Harmfulness Rating — AI Organizational Decision Automation (battery)","AI_ATTITUDES","For each of the activities you selected, please rate how harmful or not harmful your use of applications that use AI to automate organizational decision processes, such as job interviews, scheduling, or hiring/firing was to you.","LIKERT_5","1|Not at all harmful|2|Not very harmful|3|Somewhat harmful|4|Very harmful|5|Extremely harmful","","FALSE","2,3","FALSE","","FALSE","FALSE","","ai_tool_harmfulness_6","Battery of sub-items q_ai13_6a-n. a..n map 1:1 to the 14 q_ai8a response options (a=Out of curiosity, b=Entertainment, c=Social connection, d=Learn about the world, e=Tasks at work, f=School tasks, g=Additional income, h=Health info, i=Social media content, j=Personal tasks, k=Communications, l=Mental health, m=Creative pursuits, n=Other). Same conditional structure as q_ai11_6."
"q_ai7","AI Tool Used — Mixed Reality / AR/VR Headset (e.g., Meta Oculus, Apple Vision Pro, Microsoft HoloLens)","AI_ATTITUDES","In the past 4 weeks, have you used a headset that creates a mixed reality (AR/VR) experience (e.g. Meta's Oculus Quest, Apple's Vision Pro, Microsoft's HoloLens)?","BINARY_YESNO","1|Yes|2|No","","FALSE","2,3,4,5,6","FALSE","","FALSE","FALSE","","ai_tool_used_7","Gates q_ai8a_7 / q_ai10_7 / q_ai11_7 / q_ai12_7 / q_ai13_7."
"q_ai8a_7","AI Tool Purposes — Mixed Reality / AR/VR Headset (e.g., Meta Oculus, Apple Vision Pro, Microsoft HoloLens) (multiselect)","AI_ATTITUDES","You said earlier that you had used a headset that creates a mixed reality (AR/VR) experience (e.g. Meta's Oculus Quest, Apple's Vision Pro, Microsoft's HoloLens). What did you use it for? Please select all that apply.","MULTISELECT","1|Gaming|2|Watching movies or TV|3|Social interactions/networking|4|To learn something new about the world|5|Remote meetings/collaboration|6|Virtual tourism and travel|7|Improving physical health|8|Improving mental health|9|Training and education simulations|10|Shopping|11|Sports and fitness|12|Computing|13|Other, please specify","","FALSE","2,3,4,5,6","FALSE","","FALSE","FALSE","","ai_tool_purposes_7","Conditional on q_ai7=Yes. Free-text follow-up `q_ai8a_7_other` if last code (XR=13, others=14) selected. Drives the per-use-case usefulness/harmfulness batteries q_ai11_{idx} and q_ai13_{idx}."
"q_ai10_7","AI Tool Usefulness — Why (Mixed Reality / AR/VR Headset (e.g., Meta Oculus, Apple Vision Pro, Microsoft HoloLens)) (free text)","AI_ATTITUDES","In a sentence or two, please describe why your experience(s) with a headset that creates a mixed reality (AR/VR) experience (e.g. Meta's Oculus Quest, Apple's Vision Pro, Microsoft's HoloLens) was or was not useful.","STRING_OPEN","","","FALSE","2,3,4,5,6","FALSE","","FALSE","FALSE","","ai_tool_useful_desc_7",""
"q_ai11_7","AI Tool Usefulness Rating — Mixed Reality / AR/VR Headset (e.g., Meta Oculus, Apple Vision Pro, Microsoft HoloLens) (battery)","AI_ATTITUDES","For each of the activities you selected, please rate how useful or not useful your use of a headset that creates a mixed reality (AR/VR) experience (e.g. Meta's Oculus Quest, Apple's Vision Pro, Microsoft's HoloLens) was to you.","LIKERT_5","1|Not at all useful|2|Not very useful|3|Somewhat useful|4|Very useful|5|Extremely useful","","FALSE","2,3,4,5,6","FALSE","","FALSE","FALSE","","ai_tool_usefulness_7","Battery of sub-items q_ai11_7a-m stored separately in the raw data. a..m map 1:1 to the 13 q_ai8a_7 response options (a=Gaming, b=Movies/TV, c=Social interactions, d=Learn about world, e=Remote meetings, f=Virtual tourism, g=Physical health, h=Mental health, i=Training/education, j=Shopping, k=Sports/fitness, l=Computing, m=Other). Each sub-item is only asked when the corresponding q_ai8a_7 code is selected. Represented as a single dictionary row because the response scale and prompt are identical across sub-items."
"q_ai12_7","AI Tool Harmfulness — Why (Mixed Reality / AR/VR Headset (e.g., Meta Oculus, Apple Vision Pro, Microsoft HoloLens)) (free text)","AI_ATTITUDES","In a sentence or two, please describe why your experience(s) with a headset that creates a mixed reality (AR/VR) experience (e.g. Meta's Oculus Quest, Apple's Vision Pro, Microsoft's HoloLens) was or was not harmful.","STRING_OPEN","","","FALSE","2,3,4,5,6","FALSE","","FALSE","FALSE","","ai_tool_harmful_desc_7",""
"q_ai13_7","AI Tool Harmfulness Rating — Mixed Reality / AR/VR Headset (e.g., Meta Oculus, Apple Vision Pro, Microsoft HoloLens) (battery)","AI_ATTITUDES","For each of the activities you selected, please rate how harmful or not harmful your use of a headset that creates a mixed reality (AR/VR) experience (e.g. Meta's Oculus Quest, Apple's Vision Pro, Microsoft's HoloLens) was to you.","LIKERT_5","1|Not at all harmful|2|Not very harmful|3|Somewhat harmful|4|Very harmful|5|Extremely harmful","","FALSE","2,3,4,5,6","FALSE","","FALSE","FALSE","","ai_tool_harmfulness_7","Battery of sub-items q_ai13_7a-m. a..m map 1:1 to the 13 q_ai8a_7 response options (a=Gaming, b=Movies/TV, c=Social interactions, d=Learn about world, e=Remote meetings, f=Virtual tourism, g=Physical health, h=Mental health, i=Training/education, j=Shopping, k=Sports/fitness, l=Computing, m=Other). Same conditional structure as q_ai11_7."
"q_ai13","AI/Mixed Reality Excitement (general)","AI_ATTITUDES","How excited or not excited are you about the increased use of mixed reality (AR/VR) experiences (e.g. Meta's Oculus, Apple's Vision Pro, Microsoft's HoloLens) in daily life?","LIKERT_5","1|Not at all excited|2|Not very excited|3|Somewhat excited|4|Very excited|5|Extremely excited","","FALSE","2,3,4,5,6","FALSE","","FALSE","FALSE","","ai_xr_excitement","Distinct from the q_ai13_N (battery) variables — this is a single global item, not a per-use-case battery. Naming collision in the raw data is unfortunate."
"q_ai14","AI/Mixed Reality Concern (general)","AI_ATTITUDES","How concerned or not concerned are you about the increased use of mixed reality (AR/VR) experiences (e.g. Meta's Oculus, Apple's Vision Pro, Microsoft's HoloLens) in daily life?","LIKERT_5","1|Not at all concerned|2|Not very concerned|3|Somewhat concerned|4|Very concerned|5|Extremely concerned","","FALSE","2,3,4,5,6","FALSE","","FALSE","FALSE","","ai_xr_concern",""
"sc001a","Social Media Belief — Using social media is a waste of time for me","SOCIAL_MEDIA_BELIEFS","Using social media is a waste of time for me.","LIKERT_5","1|Strongly disagree|2|Disagree|3|Neither agree nor disagree|4|Agree|5|Strongly agree","","FALSE","1,2","FALSE","","FALSE","FALSE","","sm_waste_of_time","W1 and W2 only — NOT asked in W3-W6 (the gated 'asksocial' block was removed). Conditional on asksocial=1 (used at least one social platform). Handoff originally documented this as 'all waves' — confirm with Matt before relying on the absence in W3-W6."
"sc001b","Social Media Belief — Using social media strengthens and supports my relationships","SOCIAL_MEDIA_BELIEFS","Using social media strengthens and supports my relationships.","LIKERT_5","1|Strongly disagree|2|Disagree|3|Neither agree nor disagree|4|Agree|5|Strongly agree","","FALSE","1,2","FALSE","","FALSE","FALSE","","sm_strengthens_relationships","W1 and W2 only — NOT asked in W3-W6 (the gated 'asksocial' block was removed). Conditional on asksocial=1 (used at least one social platform). Handoff originally documented this as 'all waves' — confirm with Matt before relying on the absence in W3-W6."
"sc001c","Social Media Belief — Using social media facilitates my learning and growth","SOCIAL_MEDIA_BELIEFS","Using social media facilitates my learning and growth.","LIKERT_5","1|Strongly disagree|2|Disagree|3|Neither agree nor disagree|4|Agree|5|Strongly agree","","FALSE","1,2","FALSE","","FALSE","FALSE","","sm_learning_growth","W1 and W2 only — NOT asked in W3-W6 (the gated 'asksocial' block was removed). Conditional on asksocial=1 (used at least one social platform). Handoff originally documented this as 'all waves' — confirm with Matt before relying on the absence in W3-W6."
"sc001d","Social Media Belief — I'm good at managing the ways I use social media","SOCIAL_MEDIA_BELIEFS","I'm good at managing the ways I use social media.","LIKERT_5","1|Strongly disagree|2|Disagree|3|Neither agree nor disagree|4|Agree|5|Strongly agree","","FALSE","1,2","FALSE","","FALSE","FALSE","","sm_managing_well","W1 and W2 only — NOT asked in W3-W6 (the gated 'asksocial' block was removed). Conditional on asksocial=1 (used at least one social platform). Handoff originally documented this as 'all waves' — confirm with Matt before relying on the absence in W3-W6."
"sc001e","Social Media Belief — I'm in control of how I use social media","SOCIAL_MEDIA_BELIEFS","I'm in control of how I use social media.","LIKERT_5","1|Strongly disagree|2|Disagree|3|Neither agree nor disagree|4|Agree|5|Strongly agree","","FALSE","1,2","FALSE","","FALSE","FALSE","","sm_in_control","W1 and W2 only — NOT asked in W3-W6 (the gated 'asksocial' block was removed). Conditional on asksocial=1 (used at least one social platform). Handoff originally documented this as 'all waves' — confirm with Matt before relying on the absence in W3-W6."
"sc001f","Social Media Belief — I find it hard to resist the pull of social media","SOCIAL_MEDIA_BELIEFS","I find it hard to resist the pull of social media.","LIKERT_5","1|Strongly disagree|2|Disagree|3|Neither agree nor disagree|4|Agree|5|Strongly agree","","FALSE","1,2","FALSE","","FALSE","FALSE","","sm_hard_to_resist","W1 and W2 only — NOT asked in W3-W6 (the gated 'asksocial' block was removed). Conditional on asksocial=1 (used at least one social platform). Handoff originally documented this as 'all waves' — confirm with Matt before relying on the absence in W3-W6."
"ex001","Wake to Check Social Media","SOCIAL_MEDIA_BELIEFS","I wake up at night to check my social media feed(s).","LIKERT_4","1|Always or almost always|2|Frequently|3|Some of the time|4|Rarely or never","","FALSE","2","FALSE","","FALSE","FALSE","","sm_wake_to_check","W2 only. Conditional on asksocial=1."
"ex002a","Social Media Connectedness — My family","SOCIAL_MEDIA_BELIEFS","My use of social media has made me feel more connected to... My family","LIKERT_5","1|Strongly disagree|2|Disagree|3|Neither agree nor disagree|4|Agree|5|Strongly agree","","FALSE","2","FALSE","","FALSE","FALSE","","sm_connected_family","W2 only. Conditional on asksocial=1."
"ex002b","Social Media Connectedness — My friends","SOCIAL_MEDIA_BELIEFS","My use of social media has made me feel more connected to... My friends","LIKERT_5","1|Strongly disagree|2|Disagree|3|Neither agree nor disagree|4|Agree|5|Strongly agree","","FALSE","2","FALSE","","FALSE","FALSE","","sm_connected_friends","W2 only. Conditional on asksocial=1."
"ex002c","Social Media Connectedness — My neighbors and others in my community","SOCIAL_MEDIA_BELIEFS","My use of social media has made me feel more connected to... My neighbors and others in my community","LIKERT_5","1|Strongly disagree|2|Disagree|3|Neither agree nor disagree|4|Agree|5|Strongly agree","","FALSE","2","FALSE","","FALSE","FALSE","","sm_connected_neighbors","W2 only. Conditional on asksocial=1."
"ls002a","Life Satisfaction — physical health","WELLBEING","I am satisfied with my physical health.","LIKERT_7","1|Strongly disagree|2|Disagree|3|Somewhat disagree|4|Neither agree nor disagree|5|Somewhat agree|6|Agree|7|Strongly agree","","FALSE","1,2,3,4","FALSE","","FALSE","FALSE","Battery shortened in W5-W6: the column persists in uas518.csv and uas519.csv but every value is the UAS '.a' (skipped) sentinel — n_non_sentinel = 0. The original PDF empty-elseif branches correctly reflected this; Phase 1 followup #5's 'FALSE ALARM' reversal was based on column-presence verification that conflated structure with data. Re-verified 2026-05-25 by direct raw-CSV value inspection: ls002a/b/e/f are W1-W4 only. The other 8 ls002 items (c/d/g/h/i/j/k/l) carry through all 6 waves with ~2400-2900 non-sentinel values per wave.","life_sat_physical",""
"ls002b","Life Satisfaction — financial situation","WELLBEING","I am satisfied with my financial situation.","LIKERT_7","1|Strongly disagree|2|Disagree|3|Somewhat disagree|4|Neither agree nor disagree|5|Somewhat agree|6|Agree|7|Strongly agree","","FALSE","1,2,3,4","FALSE","","FALSE","FALSE","Battery shortened in W5-W6: the column persists in uas518.csv and uas519.csv but every value is the UAS '.a' (skipped) sentinel — n_non_sentinel = 0. The original PDF empty-elseif branches correctly reflected this; Phase 1 followup #5's 'FALSE ALARM' reversal was based on column-presence verification that conflated structure with data. Re-verified 2026-05-25 by direct raw-CSV value inspection: ls002a/b/e/f are W1-W4 only. The other 8 ls002 items (c/d/g/h/i/j/k/l) carry through all 6 waves with ~2400-2900 non-sentinel values per wave.","life_sat_financial",""
"ls002c","Life Satisfaction — social life","WELLBEING","I am satisfied with my social life.","LIKERT_7","1|Strongly disagree|2|Disagree|3|Somewhat disagree|4|Neither agree nor disagree|5|Somewhat agree|6|Agree|7|Strongly agree","","FALSE","1,2,3,4,5,6","FALSE","","FALSE","FALSE","","life_sat_social",""
"ls002d","Life Satisfaction — mental health","WELLBEING","I am satisfied with my mental health.","LIKERT_7","1|Strongly disagree|2|Disagree|3|Somewhat disagree|4|Neither agree nor disagree|5|Somewhat agree|6|Agree|7|Strongly agree","","FALSE","1,2,3,4,5,6","FALSE","","FALSE","FALSE","","life_sat_mental",""
"ls002e","Life Satisfaction — the amount of leisure time I have","WELLBEING","I am satisfied with the amount of leisure time I have.","LIKERT_7","1|Strongly disagree|2|Disagree|3|Somewhat disagree|4|Neither agree nor disagree|5|Somewhat agree|6|Agree|7|Strongly agree","","FALSE","1,2,3,4","FALSE","","FALSE","FALSE","Battery shortened in W5-W6: the column persists in uas518.csv and uas519.csv but every value is the UAS '.a' (skipped) sentinel — n_non_sentinel = 0. The original PDF empty-elseif branches correctly reflected this; Phase 1 followup #5's 'FALSE ALARM' reversal was based on column-presence verification that conflated structure with data. Re-verified 2026-05-25 by direct raw-CSV value inspection: ls002a/b/e/f are W1-W4 only. The other 8 ls002 items (c/d/g/h/i/j/k/l) carry through all 6 waves with ~2400-2900 non-sentinel values per wave.","life_sat_leisure",""
"ls002f","Life Satisfaction — job or other daily activities","WELLBEING","I am satisfied with my job or other daily activities.","LIKERT_7","1|Strongly disagree|2|Disagree|3|Somewhat disagree|4|Neither agree nor disagree|5|Somewhat agree|6|Agree|7|Strongly agree","","FALSE","1,2,3,4","FALSE","","FALSE","FALSE","Battery shortened in W5-W6: the column persists in uas518.csv and uas519.csv but every value is the UAS '.a' (skipped) sentinel — n_non_sentinel = 0. The original PDF empty-elseif branches correctly reflected this; Phase 1 followup #5's 'FALSE ALARM' reversal was based on column-presence verification that conflated structure with data. Re-verified 2026-05-25 by direct raw-CSV value inspection: ls002a/b/e/f are W1-W4 only. The other 8 ls002 items (c/d/g/h/i/j/k/l) carry through all 6 waves with ~2400-2900 non-sentinel values per wave.","life_sat_job",""
"ls002g","Life Satisfaction — family life","WELLBEING","I am satisfied with my family life.","LIKERT_7","1|Strongly disagree|2|Disagree|3|Somewhat disagree|4|Neither agree nor disagree|5|Somewhat agree|6|Agree|7|Strongly agree","","FALSE","1,2,3,4,5,6","FALSE","","FALSE","FALSE","","life_sat_family",""
"ls002h","Life Satisfaction — happy most of the time","WELLBEING","I feel happy most of the time.","LIKERT_7","1|Strongly disagree|2|Disagree|3|Somewhat disagree|4|Neither agree nor disagree|5|Somewhat agree|6|Agree|7|Strongly agree","","FALSE","1,2,3,4,5,6","FALSE","","FALSE","FALSE","","life_sat_happy",""
"ls002i","Life Satisfaction — negative most of the time","WELLBEING","I feel negative most of the time.","LIKERT_7","1|Strongly disagree|2|Disagree|3|Somewhat disagree|4|Neither agree nor disagree|5|Somewhat agree|6|Agree|7|Strongly agree","","TRUE","1,2,3,4,5,6","FALSE","","FALSE","FALSE","","life_sat_negative_feeling","REVERSE-CODED relative to the rest of the ls002 battery — higher score = worse wellbeing. is_reverse_coded=true triggers automatic flipping in the precompute pipeline."
"ls002j","Life Satisfaction — life is going well","WELLBEING","My life is going well.","LIKERT_7","1|Strongly disagree|2|Disagree|3|Somewhat disagree|4|Neither agree nor disagree|5|Somewhat agree|6|Agree|7|Strongly agree","","FALSE","1,2,3,4,5,6","FALSE","","FALSE","FALSE","","life_sat_going_well",""
"ls002k","Life Satisfaction — In most ways","WELLBEING","In most ways, my life is close to my ideal.","LIKERT_7","1|Strongly disagree|2|Disagree|3|Somewhat disagree|4|Neither agree nor disagree|5|Somewhat agree|6|Agree|7|Strongly agree","","FALSE","1,2,3,4,5,6","FALSE","","FALSE","FALSE","","life_sat_close_to_ideal",""
"ls002l","Life Satisfaction — life","WELLBEING","I am satisfied with my life.","LIKERT_7","1|Strongly disagree|2|Disagree|3|Somewhat disagree|4|Neither agree nor disagree|5|Somewhat agree|6|Agree|7|Strongly agree","","FALSE","1,2,3,4,5,6","FALSE","","FALSE","FALSE","","life_sat_overall",""
"ex003a","Loneliness — Lack Companionship","LONELINESS","How often do you feel that you lack companionship: Hardly ever, some of the time, or often?","LIKERT_3","1|Hardly ever|2|Some of the time|3|Often","","FALSE","2,5,6","FALSE","","FALSE","FALSE","","loneliness_companionship","UCLA 3-item loneliness short form. Asked in W2, W5, W6."
"ex003b","Loneliness — Left Out","LONELINESS","How often do you feel left out?","LIKERT_3","1|Hardly ever|2|Some of the time|3|Often","","FALSE","2,5,6","FALSE","","FALSE","FALSE","","loneliness_left_out","UCLA 3-item loneliness short form. Asked in W2, W5, W6."
"ex003c","Loneliness — Isolated","LONELINESS","How often do you feel isolated from others?","LIKERT_3","1|Hardly ever|2|Some of the time|3|Often","","FALSE","2,5,6","FALSE","","FALSE","FALSE","","loneliness_isolated","UCLA 3-item loneliness short form. Asked in W2, W5, W6."
"ds001a","Depression/Anxiety — Down-Hearted","DEPRESSION_ANXIETY","I felt down-hearted and blue.","LIKERT_4","1|Never|2|Sometimes|3|Often|4|Almost always","","FALSE","1","FALSE","","FALSE","FALSE","","depanx_downhearted","W1 only. DASS-style short-form depression/anxiety scale; 'over the past week' reference frame."
"ds001b","Depression/Anxiety — Lacked Initiative","DEPRESSION_ANXIETY","I found it difficult to work up the initiative to do things.","LIKERT_4","1|Never|2|Sometimes|3|Often|4|Almost always","","FALSE","1","FALSE","","FALSE","FALSE","","depanx_initiative","W1 only. DASS-style short-form depression/anxiety scale; 'over the past week' reference frame."
"ds001c","Depression/Anxiety — Scared","DEPRESSION_ANXIETY","I felt scared without any good reason.","LIKERT_4","1|Never|2|Sometimes|3|Often|4|Almost always","","FALSE","1","FALSE","","FALSE","FALSE","","depanx_scared","W1 only. DASS-style short-form depression/anxiety scale; 'over the past week' reference frame."
"ds001d","Depression/Anxiety — Panic Worry","DEPRESSION_ANXIETY","I was worried about situations in which I might panic and make a fool of myself.","LIKERT_4","1|Never|2|Sometimes|3|Often|4|Almost always","","FALSE","1","FALSE","","FALSE","FALSE","","depanx_panic_worry","W1 only. DASS-style short-form depression/anxiety scale; 'over the past week' reference frame."
"ds001e","Depression/Anxiety — Hard to Wind Down","DEPRESSION_ANXIETY","I found it hard to wind down.","LIKERT_4","1|Never|2|Sometimes|3|Often|4|Almost always","","FALSE","1","FALSE","","FALSE","FALSE","","depanx_wind_down","W1 only. DASS-style short-form depression/anxiety scale; 'over the past week' reference frame."
"ds001f","Depression/Anxiety — Agitated","DEPRESSION_ANXIETY","I found myself getting agitated.","LIKERT_4","1|Never|2|Sometimes|3|Often|4|Almost always","","FALSE","1","FALSE","","FALSE","FALSE","","depanx_agitated","W1 only. DASS-style short-form depression/anxiety scale; 'over the past week' reference frame."
"te001a","Tech Identity — Important Part","TECH_IDENTITY","Technology is an important part of my identity.","LIKERT_6_NOMID","1|Strongly disagree|2|Disagree|3|Somewhat disagree|4|Somewhat agree|5|Agree|6|Strongly agree","","FALSE","1","FALSE","","FALSE","FALSE","","tech_identity_important","W1 only. 6-point forced-choice Likert with NO neutral midpoint (unusual scale)."
"te001b","Tech Identity — New Tech","TECH_IDENTITY","Using new technologies is an important part of who I am.","LIKERT_6_NOMID","1|Strongly disagree|2|Disagree|3|Somewhat disagree|4|Somewhat agree|5|Agree|6|Strongly agree","","FALSE","1","FALSE","","FALSE","FALSE","","tech_identity_new_tech","W1 only. 6-point forced-choice Likert with NO neutral midpoint (unusual scale)."
"te001c","Tech Identity — Up to Date","TECH_IDENTITY","Being up to date with the newest technologies is a reflection of who I am.","LIKERT_6_NOMID","1|Strongly disagree|2|Disagree|3|Somewhat disagree|4|Somewhat agree|5|Agree|6|Strongly agree","","FALSE","1","FALSE","","FALSE","FALSE","","tech_identity_up_to_date","W1 only. 6-point forced-choice Likert with NO neutral midpoint (unusual scale)."
"te001d","Tech Identity — Has Recent","TECH_IDENTITY","I am the type of person who has the most recent technologies.","LIKERT_6_NOMID","1|Strongly disagree|2|Disagree|3|Somewhat disagree|4|Somewhat agree|5|Agree|6|Strongly agree","","FALSE","1","FALSE","","FALSE","FALSE","","tech_identity_has_recent","W1 only. 6-point forced-choice Likert with NO neutral midpoint (unusual scale)."
"te001e","Tech Identity — Good With Tech","TECH_IDENTITY","Being good with technology is an important part of my identity.","LIKERT_6_NOMID","1|Strongly disagree|2|Disagree|3|Somewhat disagree|4|Somewhat agree|5|Agree|6|Strongly agree","","FALSE","1","FALSE","","FALSE","FALSE","","tech_identity_good_with","W1 only. 6-point forced-choice Likert with NO neutral midpoint (unusual scale)."
"ex004a","Tech Regulation Level","TECH_REGULATION","How much should major technology companies be regulated by the government?","LIKERT_5","1|Much less than they are now|2|A little less than they are now|3|The same as they are now|4|A little more than they are now|5|Much more than they are now","","FALSE","5,6","FALSE","","FALSE","FALSE","","regulation_tech_companies",""
"ex004b","Tech Election-Integrity Effort","TECH_REGULATION","Do you think technology companies should do more, do less, or keep doing what they are now to protect the integrity of elections?","LIKERT_3","1|More|2|Less|3|Keep doing what they are now","","FALSE","5,6","FALSE","","FALSE","FALSE","","regulation_elections","LIKERT_3 with NO neutral midpoint (3 = status quo, not 'middle' on a more/less spectrum). Code-3 is ordered between 1 and 2 conceptually — recommend treating as categorical, not ordinal."
"ex004c","Tech User-Protection Effort","TECH_REGULATION","Do you think technology companies should do more, do less, or keep doing what they are now to protect users from harmful experiences online?","LIKERT_3","1|More|2|Less|3|Keep doing what they are now","","FALSE","5,6","FALSE","","FALSE","FALSE","","regulation_protect_users","Same ordering caveat as ex004b."
"ex005a","AI Governance Role — Government","AI_ATTITUDES","How much do you oppose or support the following playing an important role in shaping and developing AI? — Government","LIKERT_5","1|Strongly oppose|2|Somewhat oppose|3|Neither support nor oppose|4|Somewhat support|5|Strongly support","","FALSE","6","FALSE","","FALSE","FALSE","","ai_role_government","W6 only. Block also includes ex006 (4 items) in the same section."
"ex005b","AI Governance Role — Corporations","AI_ATTITUDES","How much do you oppose or support the following playing an important role in shaping and developing AI? — Corporations","LIKERT_5","1|Strongly oppose|2|Somewhat oppose|3|Neither support nor oppose|4|Somewhat support|5|Strongly support","","FALSE","6","FALSE","","FALSE","FALSE","","ai_role_corporations","W6 only. Block also includes ex006 (4 items) in the same section."
"ex005c","AI Governance Role — Universities","AI_ATTITUDES","How much do you oppose or support the following playing an important role in shaping and developing AI? — Universities","LIKERT_5","1|Strongly oppose|2|Somewhat oppose|3|Neither support nor oppose|4|Somewhat support|5|Strongly support","","FALSE","6","FALSE","","FALSE","FALSE","","ai_role_universities","W6 only. Block also includes ex006 (4 items) in the same section."
"ex006a","AI Governance Belief — Free Data Use","AI_ATTITUDES","Companies should be free to do whatever they think is best with the data they collect","LIKERT_5","1|Strongly disagree|2|Somewhat disagree|3|Neither agree nor disagree|4|Somewhat agree|5|Strongly agree","","FALSE","6","FALSE","","FALSE","FALSE","","ai_data_free_use","W6 only."
