"variable_name","construct","domain","question_text","response_type","response_options","out_of_range_codes","is_reverse_coded","waves_present","is_platform_indexed","platform_codes_applicable","wording_changed_across_waves","coding_changed_across_waves","change_notes","clean_variable_name","notes"
"ex006b","AI Governance Belief — Independent Audit","AI_ATTITUDES","Companies should be required to make anonymized user data available to independent researchers and auditors","LIKERT_5","1|Strongly disagree|2|Somewhat disagree|3|Neither agree nor disagree|4|Somewhat agree|5|Strongly agree","","FALSE","6","FALSE","","FALSE","FALSE","","ai_data_independent_audit","W6 only."
"ex006c","AI Governance Belief — Superintelligent Invest","AI_ATTITUDES","How much do you agree with the idea that society should invest in the development of new superintelligent AI systems that perform better than humans on almost any task?","LIKERT_5","1|Strongly disagree|2|Somewhat disagree|3|Neither agree nor disagree|4|Somewhat agree|5|Strongly agree","","FALSE","6","FALSE","","FALSE","FALSE","","ai_super_invest","W6 only."
"ex006d","AI Governance Belief — Public Input on Super AI","AI_ATTITUDES","If companies do develop new superintelligent AI systems that perform better than humans on almost any task, it is critical that there be processes for all people / the general public to have input into the development and potential uses of such systems.","LIKERT_5","1|Strongly disagree|2|Somewhat disagree|3|Neither agree nor disagree|4|Somewhat agree|5|Strongly agree","","FALSE","6","FALSE","","FALSE","FALSE","","ai_super_public_input","W6 only."
"ins001a","Institutional Trust — US Government","INSTITUTIONAL_TRUST","Please tell me how much confidence you, yourself, have in each of the following United States Institutions — a great deal, quite a lot, some, very little, or none? — The US government","LIKERT_5","1|None|2|Very little|3|Some|4|Quite a lot|5|A great deal","","FALSE","1","FALSE","","FALSE","FALSE","","trust_us_government","W1 only."
"ins001b","Institutional Trust — Journalists","INSTITUTIONAL_TRUST","Please tell me how much confidence you, yourself, have in each of the following United States Institutions — a great deal, quite a lot, some, very little, or none? — Journalists","LIKERT_5","1|None|2|Very little|3|Some|4|Quite a lot|5|A great deal","","FALSE","1","FALSE","","FALSE","FALSE","","trust_journalists","W1 only."
"ins001c","Institutional Trust — Network TV News","INSTITUTIONAL_TRUST","Please tell me how much confidence you, yourself, have in each of the following United States Institutions — a great deal, quite a lot, some, very little, or none? — Network Television news (e.g. ABC, NBC, CBS)","LIKERT_5","1|None|2|Very little|3|Some|4|Quite a lot|5|A great deal","","FALSE","1","FALSE","","FALSE","FALSE","","trust_network_tv_news","W1 only."
"ins001d","Institutional Trust — US Presidency","INSTITUTIONAL_TRUST","Please tell me how much confidence you, yourself, have in each of the following United States Institutions — a great deal, quite a lot, some, very little, or none? — The US presidency","LIKERT_5","1|None|2|Very little|3|Some|4|Quite a lot|5|A great deal","","FALSE","1","FALSE","","FALSE","FALSE","","trust_us_presidency","W1 only."
"ins001e","Institutional Trust — Police","INSTITUTIONAL_TRUST","Please tell me how much confidence you, yourself, have in each of the following United States Institutions — a great deal, quite a lot, some, very little, or none? — The police","LIKERT_5","1|None|2|Very little|3|Some|4|Quite a lot|5|A great deal","","FALSE","1","FALSE","","FALSE","FALSE","","trust_police","W1 only."
"ins001f","Institutional Trust — CDC","INSTITUTIONAL_TRUST","Please tell me how much confidence you, yourself, have in each of the following United States Institutions — a great deal, quite a lot, some, very little, or none? — The Centers for Disease Control and Prevention (CDC)","LIKERT_5","1|None|2|Very little|3|Some|4|Quite a lot|5|A great deal","","FALSE","1","FALSE","","FALSE","FALSE","","trust_cdc","W1 only."
"ins001g","Institutional Trust — Social Media Companies","INSTITUTIONAL_TRUST","Please tell me how much confidence you, yourself, have in each of the following United States Institutions — a great deal, quite a lot, some, very little, or none? — Social media companies","LIKERT_5","1|None|2|Very little|3|Some|4|Quite a lot|5|A great deal","","FALSE","1","FALSE","","FALSE","FALSE","","trust_social_media_companies","W1 only."
"ins001h","Institutional Trust — Tech Companies","INSTITUTIONAL_TRUST","Please tell me how much confidence you, yourself, have in each of the following United States Institutions — a great deal, quite a lot, some, very little, or none? — Technology companies","LIKERT_5","1|None|2|Very little|3|Some|4|Quite a lot|5|A great deal","","FALSE","1","FALSE","","FALSE","FALSE","","trust_tech_companies","W1 only."
"citizenus","US Citizenship","DEMOGRAPHICS","Are you a citizen of the United States?","BINARY_YESNO","1|Yes|2|No","","FALSE","1,2,3,4,5,6","FALSE","","FALSE","FALSE","","is_us_citizen","Preload-supported; only asked when empty."
"statereside","State of Residence","DEMOGRAPHICS","In what state are you currently residing?","SINGLE_SELECT_CATEGORICAL","1|Alaska|2|Alabama|3|Arizona|4|Arkansas|5|California|6|Colorado|7|Connecticut|8|Delaware|9|Florida|10|Georgia|11|Hawaii|12|Idaho|13|Illinois|14|Indiana|15|Iowa|16|Kansas|17|Kentucky|18|Louisiana|19|Maine|20|Maryland|21|Massachusetts|22|Michigan|23|Minnesota|24|Mississippi|25|Missouri|26|Montana|27|Nebraska|28|Nevada|29|New Hampshire|30|New Jersey|31|New Mexico|32|New York|33|North Carolina|34|North Dakota|35|Ohio|36|Oklahoma|37|Oregon|38|Pennsylvania|39|Rhode Island|40|South Carolina|41|South Dakota|42|Tennessee|43|Texas|44|Utah|45|Vermont|46|Virginia|47|Washington|48|West Virginia|49|Wisconsin|50|Wyoming|51|Washington DC|52|Puerto Rico","","FALSE","1,2,3,4,5,6","FALSE","","FALSE","FALSE","","state_of_residence","Asked only when citizenus=1 and statereside empty (preload-supported)."
"gender","Gender (panel preload)","DEMOGRAPHICS","Gender — value preloaded from the UAS panel tracker rather than asked in each wave.","SINGLE_SELECT_CATEGORICAL","","","FALSE","1,2,3,4,5,6","FALSE","","TBD","TBD","TBD — verify presence and coding in raw CSVs in Phase 1.","gender","PANEL PRELOAD — not in the survey flow PDFs (carried as tracker preload by UAS for every panel member; see getTrackerPreload() pattern in PDFs). Referenced in r/clean/utils/preprocessing/transform_data.R. waves_present marked 'TBD' pending Phase 1 audit verification of the raw CSV column headers. Response coding TBD — look up in UAS panel documentation. Cleaned via transform_gender()."
"age","Age (panel preload)","DEMOGRAPHICS","Age in years — preloaded from the UAS panel tracker.","RANGE_NUMERIC","","","FALSE","1,2,3,4,5,6","FALSE","","TBD","TBD","TBD — verify presence in raw CSVs in Phase 1.","age","PANEL PRELOAD — not in the survey flow PDFs (carried as tracker preload by UAS for every panel member; see getTrackerPreload() pattern in PDFs). Referenced in r/clean/utils/preprocessing/transform_data.R. waves_present marked 'TBD' pending Phase 1 audit verification of the raw CSV column headers. Response coding TBD — look up in UAS panel documentation. Cleaned via transform_age(); typically bucketed downstream."
"race","Race (panel preload)","DEMOGRAPHICS","Race — preloaded from the UAS panel tracker. Combined with hisplatino during cleaning to produce a unified race/ethnicity category.","SINGLE_SELECT_CATEGORICAL","","","FALSE","1,2,3,4,5,6","FALSE","","TBD","TBD","TBD — verify presence and coding in raw CSVs in Phase 1.","race","PANEL PRELOAD — not in the survey flow PDFs (carried as tracker preload by UAS for every panel member; see getTrackerPreload() pattern in PDFs). Referenced in r/clean/utils/preprocessing/transform_data.R. waves_present marked 'TBD' pending Phase 1 audit verification of the raw CSV column headers. Response coding TBD — look up in UAS panel documentation. Combined with hisplatino via transform_race()."
"hisplatino","Hispanic/Latino Identity (panel preload)","DEMOGRAPHICS","Hispanic/Latino identity flag — preloaded from the UAS panel tracker. Combined with race during cleaning.","BINARY_YESNO","","","FALSE","1,2,3,4,5,6","FALSE","","TBD","TBD","TBD — verify presence and coding in raw CSVs in Phase 1.","hispanic_latino","PANEL PRELOAD — not in the survey flow PDFs (carried as tracker preload by UAS for every panel member; see getTrackerPreload() pattern in PDFs). Referenced in r/clean/utils/preprocessing/transform_data.R. waves_present marked 'TBD' pending Phase 1 audit verification of the raw CSV column headers. Response coding TBD — look up in UAS panel documentation. Combined with race via transform_race()."
"education","Education (panel preload)","DEMOGRAPHICS","Educational attainment — preloaded from the UAS panel tracker.","SINGLE_SELECT_CATEGORICAL","","","FALSE","1,2,3,4,5,6","FALSE","","TBD","TBD","TBD — verify presence and coding in raw CSVs in Phase 1.","education","PANEL PRELOAD — not in the survey flow PDFs (carried as tracker preload by UAS for every panel member; see getTrackerPreload() pattern in PDFs). Referenced in r/clean/utils/preprocessing/transform_data.R. waves_present marked 'TBD' pending Phase 1 audit verification of the raw CSV column headers. Response coding TBD — look up in UAS panel documentation. Cleaned via transform_edu() into edu_bucket."
"hhincome","Household Income (panel preload)","DEMOGRAPHICS","Household income — preloaded from the UAS panel tracker.","SINGLE_SELECT_CATEGORICAL","","","FALSE","1,2,3,4,5,6","FALSE","","TBD","TBD","Phase 1 verified 2026-05-24: column present in all 6 raw CSVs. Response coding TBD — look up in UAS panel documentation.","hhincome","PANEL PRELOAD — not in the survey flow PDFs (carried as tracker preload by UAS for every panel member; see getTrackerPreload() pattern in PDFs). Referenced in r/clean/utils/preprocessing/transform_data.R. waves_present marked 'TBD' pending Phase 1 audit verification of the raw CSV column headers. Response coding TBD — look up in UAS panel documentation. Cleaned via transform_income() into income bucket."
"maritalstatus","Marital Status (panel preload)","DEMOGRAPHICS","Marital status — preloaded from the UAS panel tracker.","SINGLE_SELECT_CATEGORICAL","","","FALSE","1,2,3,4,5,6","FALSE","","TBD","TBD","Phase 1 verified 2026-05-24: column present in all 6 raw CSVs.","marital_status","PANEL PRELOAD — not in the survey flow PDFs (carried as tracker preload by UAS for every panel member; see getTrackerPreload() pattern in PDFs). Referenced in r/clean/utils/preprocessing/transform_data.R. waves_present marked 'TBD' pending Phase 1 audit verification of the raw CSV column headers. Response coding TBD — look up in UAS panel documentation. Discovered during Phase 1 CSV-header audit; not referenced by transform_data.R yet."
"primary_respondent","Primary Respondent Flag (panel meta)","DEMOGRAPHICS","Whether this respondent is the primary respondent for their household (per UAS panel metadata).","BINARY_YESNO","","","FALSE","1,2,3,4,5,6","FALSE","","FALSE","FALSE","Phase 1 verified 2026-05-24: column present in all 6 raw CSVs.","primary_respondent","PANEL PRELOAD — not in the survey flow PDFs (carried as tracker preload by UAS for every panel member; see getTrackerPreload() pattern in PDFs). Referenced in r/clean/utils/preprocessing/transform_data.R. waves_present marked 'TBD' pending Phase 1 audit verification of the raw CSV column headers. Response coding TBD — look up in UAS panel documentation. Discovered during Phase 1 CSV-header audit. Useful for household-level deduplication if needed."
"bornus","Born in US (panel preload)","DEMOGRAPHICS","Whether respondent was born in the United States — preloaded from the UAS panel tracker.","BINARY_YESNO","","","FALSE","1,2,3,4,5,6","FALSE","","FALSE","FALSE","Phase 1 verified 2026-05-24: column present in all 6 raw CSVs.","is_born_us","PANEL PRELOAD — not in the survey flow PDFs (carried as tracker preload by UAS for every panel member; see getTrackerPreload() pattern in PDFs). Referenced in r/clean/utils/preprocessing/transform_data.R. waves_present marked 'TBD' pending Phase 1 audit verification of the raw CSV column headers. Response coding TBD — look up in UAS panel documentation. Discovered during Phase 1 CSV-header audit."
"stateborn","State of Birth (panel preload)","DEMOGRAPHICS","State (or country) of birth — preloaded from the UAS panel tracker.","SINGLE_SELECT_CATEGORICAL","","","FALSE","1,2,3,4,5,6","FALSE","","FALSE","FALSE","Phase 1 verified 2026-05-24: column present in all 6 raw CSVs.","state_of_birth","PANEL PRELOAD — not in the survey flow PDFs (carried as tracker preload by UAS for every panel member; see getTrackerPreload() pattern in PDFs). Referenced in r/clean/utils/preprocessing/transform_data.R. waves_present marked 'TBD' pending Phase 1 audit verification of the raw CSV column headers. Response coding TBD — look up in UAS panel documentation. Discovered during Phase 1 CSV-header audit. Coding TBD — UAS panel may use a different state-code numbering than statereside."
"language","Survey Language (panel meta)","DEMOGRAPHICS","Survey language preference recorded by the UAS panel tracker.","SINGLE_SELECT_CATEGORICAL","","","FALSE","1,2,3,4,5,6","FALSE","","FALSE","FALSE","Phase 1 verified 2026-05-24: column present in all 6 raw CSVs.","survey_language","PANEL PRELOAD — not in the survey flow PDFs (carried as tracker preload by UAS for every panel member; see getTrackerPreload() pattern in PDFs). Referenced in r/clean/utils/preprocessing/transform_data.R. waves_present marked 'TBD' pending Phase 1 audit verification of the raw CSV column headers. Response coding TBD — look up in UAS panel documentation. Discovered during Phase 1 CSV-header audit. Useful for sub-population analyses by language."
"dateofbirth_year","Year of Birth (panel preload)","DEMOGRAPHICS","Year of birth — preloaded from the UAS panel tracker (more precise than the bucketed `age` field).","RANGE_NUMERIC","","","FALSE","1,2,3,4,5,6","FALSE","","FALSE","FALSE","Phase 1 verified 2026-05-24: column present in all 6 raw CSVs.","year_of_birth","PANEL PRELOAD — not in the survey flow PDFs (carried as tracker preload by UAS for every panel member; see getTrackerPreload() pattern in PDFs). Referenced in r/clean/utils/preprocessing/transform_data.R. waves_present marked 'TBD' pending Phase 1 audit verification of the raw CSV column headers. Response coding TBD — look up in UAS panel documentation. Use to derive exact age at time of each wave (subtract from wave_dates start year) for cohort analyses."
"agerange","Age Range Bucket (panel preload)","DEMOGRAPHICS","Age range bucket — preloaded from the UAS panel tracker.","SINGLE_SELECT_CATEGORICAL","","","FALSE","1,2,3,4,5,6","FALSE","","FALSE","FALSE","Phase 1 verified 2026-05-24: column present in all 6 raw CSVs.","age_range","PANEL PRELOAD — not in the survey flow PDFs (carried as tracker preload by UAS for every panel member; see getTrackerPreload() pattern in PDFs). Referenced in r/clean/utils/preprocessing/transform_data.R. waves_present marked 'TBD' pending Phase 1 audit verification of the raw CSV column headers. Response coding TBD — look up in UAS panel documentation. Bucket of `age` (which is a numeric/string). transform_age() in transform_functions.R uses `age` rather than this; flagged for Phase 2 review."
"regis","Voter Registration in Time","POLITICAL","Regardless of whether you voted in the November 8 2022 election, were you registered to vote using your current address (or by absentee) in time to cast a ballot in the election if you had chosen to do so?","SINGLE_SELECT_CATEGORICAL","1|Yes, I was registered to vote in time for the election|2|I was not registered to vote in time for the election|3|Not sure","","FALSE","1,2,3","FALSE","","FALSE","FALSE","DATA-AVAILABILITY FINDING (Phase 1 verified 2026-05-24): this column is present in raw CSVs only for W1-W3. W4-W6 CSVs contain NEITHER the column nor its preload_* counterpart. Despite the PDF flows showing the question for every wave, the data was apparently never saved out for W4-W6. Implication: wave-over-wave political affiliation analyses must be restricted to W1-W3 or rely on cross-wave joins via uasid (the same panel member's earlier-wave party affiliation can carry forward as a static covariate).","voter_registered","Preload-supported (preload_regis present in W1-W3). Conditional on citizenus=1 and statereside != 34 (North Dakota)."
"partyreg","Party Registration","POLITICAL","Are you registered as:","SINGLE_SELECT_CATEGORICAL","1|Democrat|2|Republican|3|No political party (independent)|4|No political party (state does not allow registration by party)|5|Libertarian|6|Green party|7|Some other party","","FALSE","1,2,3","FALSE","","FALSE","FALSE","DATA-AVAILABILITY FINDING (Phase 1 verified 2026-05-24): this column is present in raw CSVs only for W1-W3. W4-W6 CSVs contain NEITHER the column nor its preload_* counterpart. Despite the PDF flows showing the question for every wave, the data was apparently never saved out for W4-W6. Implication: wave-over-wave political affiliation analyses must be restricted to W1-W3 or rely on cross-wave joins via uasid (the same panel member's earlier-wave party affiliation can carry forward as a static covariate).","party_registration","Preload-supported (preload_partyreg present in W1-W3). Conditional on (statereside=34 OR (regis=1 AND statereside != 34))."
"party_affil","Party Affiliation","POLITICAL","Regardless of if or how you are registered to vote, are you more closely aligned with...","SINGLE_SELECT_CATEGORICAL","1|Democrats|2|Republicans|3|Independents (no political party)|4|Libertarians|5|Green party|6|Some other party|7|Not aligned with any political party","","FALSE","1,2,3","FALSE","","FALSE","FALSE","DATA-AVAILABILITY FINDING (Phase 1 verified 2026-05-24): this column is present in raw CSVs only for W1-W3. W4-W6 CSVs contain NEITHER the column nor its preload_* counterpart. Despite the PDF flows showing the question for every wave, the data was apparently never saved out for W4-W6. Implication: wave-over-wave political affiliation analyses must be restricted to W1-W3 or rely on cross-wave joins via uasid (the same panel member's earlier-wave party affiliation can carry forward as a static covariate).","party_affiliation","Preload-supported (preload_party_affil present in W1-W3). Codes 3 and 7 gate lean_affil."
"lean_affil","Party Lean (Independents/Unaligned)","POLITICAL","Generally speaking, do you lean more toward affiliating with Democrats or with Republicans?","SINGLE_SELECT_CATEGORICAL","1|Lean toward Democrats|2|Lean toward Republicans|3|Do not lean toward either party","","FALSE","1,2,3","FALSE","","FALSE","FALSE","DATA-AVAILABILITY FINDING (Phase 1 verified 2026-05-24): this column is present in raw CSVs only for W1-W3. W4-W6 CSVs contain NEITHER the column nor its preload_* counterpart. Despite the PDF flows showing the question for every wave, the data was apparently never saved out for W4-W6. Implication: wave-over-wave political affiliation analyses must be restricted to W1-W3 or rely on cross-wave joins via uasid (the same panel member's earlier-wave party affiliation can carry forward as a static covariate).","party_lean","Conditional on party_affil in {3, 7}. Preload-supported (preload_lean_affil present in W1-W3)."
"rate_self","Political Ideology — Self (0-100)","POLITICAL","On a scale from 0 to 100 where 0 is the most liberal and 100 is the most conservative, what number would you give to yourself?","SCALE_0_100","","","FALSE","1,2,3,4,5,6","FALSE","","FALSE","FALSE","","political_ideology_self",""
"scim_therm_con","Feeling Thermometer — Conservatives","POLITICAL","Please indicate how you feel toward conservatives using the scale below. 10 means that you feel very favorably or warm toward them, 0 that you feel very unfavorable or cold, and 5 is neutral.","SCALE_0_10","","","FALSE","1,2,3,4,5,6","FALSE","","FALSE","FALSE","","feeling_therm_conservatives","Raw CSV column name is lowercase (e.g., `scim_therm_con`); PDF flow renders it as 'SCIM_THERM_CON'. Slider+textbox input in the survey; the `*_SLID` / `*_BOX` UI-tracking companion variables documented in the PDFs are NOT stored in any of the 6 raw CSVs (Phase 1 verified 2026-05-24). Display order vs. paired CON/LIB item is randomized via scim_order_cons_lib and scim_order_rating_comfort (also in raw CSVs)."
"scim_therm_lib","Feeling Thermometer — Liberals","POLITICAL","Please indicate how you feel toward liberals using the scale below. 10 means that you feel very favorably or warm toward them, 0 that you feel very unfavorable or cold, and 5 is neutral.","SCALE_0_10","","","FALSE","1,2,3,4,5,6","FALSE","","FALSE","FALSE","","feeling_therm_liberals","Raw CSV column name is lowercase (e.g., `scim_therm_con`); PDF flow renders it as 'SCIM_THERM_CON'. Slider+textbox input in the survey; the `*_SLID` / `*_BOX` UI-tracking companion variables documented in the PDFs are NOT stored in any of the 6 raw CSVs (Phase 1 verified 2026-05-24). Display order vs. paired CON/LIB item is randomized via scim_order_cons_lib and scim_order_rating_comfort (also in raw CSVs)."
"scim_friends_con","Comfort Having Conservative Friends","POLITICAL","How comfortable are you having friends who are conservative? 10 means that you feel extremely comfortable, 0 means that you do not feel comfortable at all.","SCALE_0_10","","","FALSE","1,2,3,4,5,6","FALSE","","FALSE","FALSE","","comfort_conservative_friends","Raw CSV column name is lowercase (e.g., `scim_therm_con`); PDF flow renders it as 'SCIM_THERM_CON'. Slider+textbox input in the survey; the `*_SLID` / `*_BOX` UI-tracking companion variables documented in the PDFs are NOT stored in any of the 6 raw CSVs (Phase 1 verified 2026-05-24). Display order vs. paired CON/LIB item is randomized via scim_order_cons_lib and scim_order_rating_comfort (also in raw CSVs)."
"scim_friends_lib","Comfort Having Liberal Friends","POLITICAL","How comfortable are you having friends who are liberal? 10 means that you feel extremely comfortable, 0 means that you do not feel comfortable at all.","SCALE_0_10","","","FALSE","1,2,3,4,5,6","FALSE","","FALSE","FALSE","","comfort_liberal_friends","Raw CSV column name is lowercase (e.g., `scim_therm_con`); PDF flow renders it as 'SCIM_THERM_CON'. Slider+textbox input in the survey; the `*_SLID` / `*_BOX` UI-tracking companion variables documented in the PDFs are NOT stored in any of the 6 raw CSVs (Phase 1 verified 2026-05-24). Display order vs. paired CON/LIB item is randomized via scim_order_cons_lib and scim_order_rating_comfort (also in raw CSVs)."
"vote2024","2024 Presidential Preference","POLITICAL","Regardless of whether you voted in the presidential election in November, which of the two major party candidates did you prefer to have as the President of the United States for the next four years?","SINGLE_SELECT_CATEGORICAL","1|Kamala Harris (Democrat)|2|Donald Trump (Republican)|3|No preference","","FALSE","6","FALSE","","FALSE","FALSE","","vote_2024_preference","W6 only."
"cs_001","Survey Interest","SURVEY_QUALITY","Could you tell us how interesting or uninteresting you found the questions in this survey?","LIKERT_5","1|Very interesting|2|Interesting|3|Neither interesting nor uninteresting|4|Uninteresting|5|Very uninteresting","","FALSE","1,2,3,4,5,6","FALSE","","FALSE","FALSE","","survey_interest","Raw CSV column name is `cs_001` (lowercase); PDF flow renders it as 'CS_001'."
"cs_003","Survey Comments (free text)","SURVEY_QUALITY","Do you have any other comments on the survey? Please type these in the box below.","STRING_OPEN","","","FALSE","1,2,3,4,5,6","FALSE","","FALSE","FALSE","","survey_comments","Phase 1 verified 2026-05-24: this free-text column does NOT appear in the main uas51X.csv files. PII-sensitive free-text fields are stored separately in per-question scrubbed CSV files under data/text/uasNNN_<qnum> - c.csv (see r/clean/utils/preprocessing/process_text_data.R, which expects this layout). Out of scope for the Phase 3 numeric/categorical precompute, but useful for qualitative subsamples."
